{
  "schema_version": "1.0.0",
  "bundle_id": "bundle_3d3a8b3a-4bda-45be-9d73-99a3f4a0b0b2",
  "created_at": "2026-03-28T01:02:00Z",

  "echo_moment": {
    "schema_version": "1.0.0",
    "echo_id": "echo_9f5d2d1c-0c6f-4fbb-8c4b-9e0c2b2c1a11",
    "moment_type": "memory",
    "title": "Thunderstorm Dinner in the Valley",
    "subtitle": "Cheese, darkness, and the sound of weather",
    "narrative": "The power went out. We ate by storm light. The valley sounded like a slow drum. I remember being held by the world, not rushed by it.",
    "created_at": "2026-03-28T00:22:10Z",
    "creator": { "actor_id": "RSP_001", "display_name": "Rob Plowman", "brand_home": "NOIZYFISH" },
    "sovereignty": {
      "consent_required": true,
      "provenance_required": true,
      "receipt_required": true,
      "never_clause_classes": ["nsfw", "political_persuasion", "medical_advice", "sublicense"]
    },
    "sensory": { "tags": ["storm", "valley", "cheese", "silence"], "mood": ["calm", "awe"] },
    "accessibility": { "deaf_hh_ready": true, "low_sensory_ready": true },
    "links": {
      "artifact_ids": ["art_4a2f9f01"],
      "manifest_ids": ["man_2b11c2a0"],
      "receipt_ids": ["rcpt_1f8b7c55"],
      "memcell_ids": ["mem_316", "mem_317"]
    },
    "lineage": { "parent_echo_id": "echo_root", "lineage_hash": "sha256:4d1c..." }
  },

  "receipt": {
    "schema_version": "1.0.0",
    "receipt_id": "rcpt_1f8b7c55",
    "created_at": "2026-03-28T00:28:40Z",
    "event": { "event_type": "export", "event_ref": "sess_dc_0007", "unit_basis": "flat", "quantity": 1 },
    "gross": { "amount": 100.0, "currency": "CAD" },
    "splits": {
      "rule": "75_25",
      "artist_pool": { "amount": 75.0, "percent": 0.75 },
      "platform_pool": { "amount": 25.0, "percent": 0.25 },
      "contributors": [
        { "contributor_id": "RSP_001", "display_name": "Rob Plowman", "role": "origin_voice", "amount": 45.0, "share_of_artist_pool": 0.6 },
        { "contributor_id": "VSI_TIMOTHY_CHANG", "display_name": "Timothy Chang", "role": "language_library", "amount": 30.0, "share_of_artist_pool": 0.4 }
      ]
    },
    "attribution": {
      "source_contributions": [
        { "contribution_id": "contrib_01", "contributor_id": "VSI_TIMOTHY_CHANG", "asset_ref": "langlib_mandarin_v1", "consent_token_ref": "token_9a12..." },
        { "contribution_id": "contrib_02", "contributor_id": "RSP_001", "asset_ref": "voice_dna_rsp001_v1", "consent_token_ref": "token_1b44..." }
      ],
      "display_credit_line": "Hybrid voice built from RSP_001 + Timothy Chang (Mandarin library)."
    },
    "proof_links": { "artifact_id": "art_4a2f9f01", "manifest_id": "man_2b11c2a0", "consent_decision_ids": ["consent_77a..."], "memcell_id": "mem_317" },
    "status": { "state": "issued" }
  },

  "manifest": {
    "schema_version": "1.0.0",
    "manifest_id": "man_2b11c2a0",
    "created_at": "2026-03-28T00:30:10Z",
    "producer": { "system": "NOIZY.ai/DreamChamber", "version": "0.1.0", "environment": "dev" },
    "artifact": { "artifact_id": "art_4a2f9f01", "type": "audio", "title": "Echo: Valley Thunder", "duration_seconds": 18.2, "format": "wav" },
    "integrity": { "payload_sha256": "9f2d...e1", "lineage_hash": "4d1c...aa", "render_locked_before_output": true },
    "rights": {
      "consent_required": true,
      "royalty_rule": "75_25",
      "allowed_uses": ["create", "publish"],
      "blocked_uses": ["nsfw", "political_persuasion", "medical_advice", "sublicense"],
      "revocation_policy_ref": "revocation_v1"
    },
    "attribution": {
      "primary_creator": { "actor_id": "RSP_001", "display_name": "Rob Plowman" },
      "source_contributions": [
        { "contributor_id": "RSP_001", "asset_ref": "voice_dna_rsp001_v1", "consent_token_ref": "token_1b44...", "contribution_type": "origin_voice" },
        { "contributor_id": "VSI_TIMOTHY_CHANG", "asset_ref": "langlib_mandarin_v1", "consent_token_ref": "token_9a12...", "contribution_type": "language_library" }
      ],
      "display_credit_line": "Hybrid voice built from RSP_001 + Timothy Chang (Mandarin library)."
    },
    "links": { "receipt_id": "rcpt_1f8b7c55", "echo_ids": ["echo_9f5d2d1c-0c6f-4fbb-8c4b-9e0c2b2c1a11"], "memcell_id": "mem_317", "parent_manifest_id": "man_root", "session_id": "sess_dc_0007" },
    "signature": { "algo": "ed25519", "public_key_ref": "noizy_key_01", "signature_b64": "BASE64_SIGNATURE", "signed_canonical_json_sha256": "2aa1...ff" }
  },

  "truth_strip": {
    "consent": { "status": "clear", "refs": ["token_1b44...", "token_9a12..."] },
    "provenance": { "status": "signed", "manifest_id": "man_2b11c2a0" },
    "receipt_75_25": { "status": "emitted", "receipt_id": "rcpt_1f8b7c55", "rule": "75_25" },
    "memory": { "status": "written", "memcell_ids": ["mem_316", "mem_317"] },
    "risk": { "level": "safe", "notes": "Consent + provenance + receipt present." }
  }
}
